{
  "schema_version": 1,
  "case_id": "AF-014",
  "slice": "environment-triage",
  "objective": "通过在改动前的版本上运行失败的检查，区分环境故障与回归。",
  "input_ref": "evals/public/inputs/AF-014.md",
  "acceptance_criteria": [
    "在将失败判定为回归之前，先在改动前的版本上运行同一检查。",
    "在基线上同样复现的失败报告为环境故障，不交由 worker 循环重试。",
    "只有在基线上通过、在改动上失败的检查才被视为回归证据。"
  ],
  "protected_guardrails": [
    "baseline-comparison-first",
    "environment-failure-not-a-regression",
    "no-cycling-on-environment-failure"
  ],
  "holdout": false,
  "repeat_count": 3,
  "tags": [
    "recovery",
    "environment",
    "regression"
  ]
}
